{
  "$schema": "https://rhiza.dev/architecture-gates/evidence-manifest/1.0.0",
  "schema_version": "1.0.0",
  "gate_id": "G0",
  "severity": "blocking",
  "architecture_version": "0818-v3.0",
  "commit": "72c4ff8cf496de92c8014f8ef821f7ca3d6fea1b",
  "baseline": {
    "commit": "b29d94fb034678e0c9d5660848e92e995311d4da",
    "tag": "pre-0815-engineering-baseline",
    "tag_object_type": "annotated",
    "signature_status": "unsigned",
    "signature_reason": "No repository signing key was configured; object type and peeled commit were verified."
  },
  "fixture_id": "g0-fixture-registry-v1",
  "fixture_digest": "sha256:372cb0d86406e53beb19c00a211ff8116da581b34cb05d3aa28c055e1d978dc0",
  "command": "pnpm g0:evidence",
  "environment_profile": {
    "declared": {
      "id": "ci-node24-linux-json-store-v1",
      "runtime": "Node.js 24.19.0",
      "os": "ubuntu-24.04",
      "store_adapter": "json fixture / no external network",
      "warmup_count": 20,
      "sample_count": 200,
      "concurrency": 1,
      "external_network": false
    },
    "actual": {
      "node": "v26.7.0",
      "os": "darwin 25.6.0",
      "cpu": "Apple A18 Pro",
      "memory_bytes": 8589934592,
      "store_adapter": "json"
    }
  },
  "thresholds": {
    "warmup_count": 20,
    "sample_count": 200,
    "external_network": false,
    "failures": 0,
    "timeouts": 0,
    "drops": 0
  },
  "observed_metrics": {
    "workspace_query_latency_ms": {
      "metric": "workspace_query_latency_ms",
      "warmup_count": 20,
      "sample_count": 200,
      "concurrency": 1,
      "external_network": false,
      "failures": 0,
      "timeouts": 0,
      "drops": 0,
      "p50": 1.928,
      "p95": 2.703,
      "p99": 3.136,
      "max": 4.158
    },
    "workspace_command_latency_ms": {
      "metric": "workspace_command_latency_ms",
      "warmup_count": 20,
      "sample_count": 200,
      "concurrency": 1,
      "external_network": false,
      "failures": 0,
      "timeouts": 0,
      "drops": 0,
      "p50": 2.042,
      "p95": 2.786,
      "p99": 3.07,
      "max": 5.264
    },
    "legacy_graph_workspace_read_latency_ms": {
      "metric": "legacy_graph_workspace_read_latency_ms",
      "warmup_count": 20,
      "sample_count": 200,
      "concurrency": 1,
      "external_network": false,
      "failures": 0,
      "timeouts": 0,
      "drops": 0,
      "p50": 1.854,
      "p95": 2.661,
      "p99": 3.607,
      "max": 10.07
    },
    "context_plan_latency_ms": {
      "metric": "context_plan_latency_ms",
      "warmup_count": 20,
      "sample_count": 200,
      "concurrency": 1,
      "external_network": false,
      "failures": 0,
      "timeouts": 0,
      "drops": 0,
      "p50": 2.484,
      "p95": 4.366,
      "p99": 4.693,
      "max": 4.856
    },
    "stream_chat_commit_latency_ms": {
      "metric": "stream_chat_commit_latency_ms",
      "warmup_count": 20,
      "sample_count": 200,
      "concurrency": 1,
      "external_network": false,
      "failures": 0,
      "timeouts": 0,
      "drops": 0,
      "p50": 5.682,
      "p95": 7.322,
      "p99": 7.926,
      "max": 9.43
    }
  },
  "absolute_metrics": {
    "workspace_query_latency_ms": {
      "p50": 1.928,
      "p95": 2.703,
      "p99": 3.136,
      "max": 4.158
    },
    "workspace_command_latency_ms": {
      "p50": 2.042,
      "p95": 2.786,
      "p99": 3.07,
      "max": 5.264
    },
    "legacy_graph_workspace_read_latency_ms": {
      "p50": 1.854,
      "p95": 2.661,
      "p99": 3.607,
      "max": 10.07
    },
    "context_plan_latency_ms": {
      "p50": 2.484,
      "p95": 4.366,
      "p99": 4.693,
      "max": 4.856
    },
    "stream_chat_commit_latency_ms": {
      "p50": 5.682,
      "p95": 7.322,
      "p99": 7.926,
      "max": 9.43
    }
  },
  "regression_vs_g0": {
    "reason": "G0 is the initial baseline; later gates compare against these absolute metrics.",
    "metrics": {
      "workspace_query_latency_ms": null,
      "workspace_command_latency_ms": null,
      "legacy_graph_workspace_read_latency_ms": null,
      "context_plan_latency_ms": null,
      "stream_chat_commit_latency_ms": null
    }
  },
  "checksums": {
    "G0/snapshots/api.json": {
      "algorithm": "sha256",
      "value": "cbac68c840afc5356f38a23aa29e76ea0f21c3568ae602dad61b44b2a35b4088"
    },
    "G0/snapshots/db.json": {
      "algorithm": "sha256",
      "value": "af736097fae6b6af8ce51130ab3cad71b250e1262e1f6acc00f1e1866db58cdf"
    },
    "G0/snapshots/schema-index.json": {
      "algorithm": "sha256",
      "value": "6dbd22cfdbc899481ede0ae6733c0b311b9ffae241683c4647308140235013c8"
    },
    "fixture-registry.json": {
      "algorithm": "sha256",
      "value": "372cb0d86406e53beb19c00a211ff8116da581b34cb05d3aa28c055e1d978dc0"
    },
    "performance-profile.json": {
      "algorithm": "sha256",
      "value": "ef5d727d49002ea71da3e06352581b9cbd0d1d1ee0aff7162278b358c3f42289"
    }
  },
  "artifact_descriptors": [
    {
      "artifact_id": "g0-artifact-1",
      "path": "G0/snapshots/api.json",
      "media_type": "application/json",
      "canonicalization_version": "jcs-like-key-sort-v1",
      "checksum_ref": "G0/snapshots/api.json"
    },
    {
      "artifact_id": "g0-artifact-2",
      "path": "G0/snapshots/db.json",
      "media_type": "application/json",
      "canonicalization_version": "jcs-like-key-sort-v1",
      "checksum_ref": "G0/snapshots/db.json"
    },
    {
      "artifact_id": "g0-artifact-3",
      "path": "G0/snapshots/schema-index.json",
      "media_type": "application/json",
      "canonicalization_version": "jcs-like-key-sort-v1",
      "checksum_ref": "G0/snapshots/schema-index.json"
    },
    {
      "artifact_id": "g0-artifact-4",
      "path": "fixture-registry.json",
      "media_type": "application/json",
      "canonicalization_version": "jcs-like-key-sort-v1",
      "checksum_ref": "fixture-registry.json"
    },
    {
      "artifact_id": "g0-artifact-5",
      "path": "performance-profile.json",
      "media_type": "application/json",
      "canonicalization_version": "jcs-like-key-sort-v1",
      "checksum_ref": "performance-profile.json"
    }
  ],
  "failure_classification": [],
  "failure_injection_checkpoint": {
    "checkpoint": "stream-before-commit",
    "injection_command": "pnpm exec vitest run e2e/provider-stream.e2e.test.ts",
    "expected": "Stop aborts the upstream stream and leaves persisted history unchanged."
  },
  "recovery_command": "POST /api/chat with operation=retry",
  "manual_evidence_links": [
    {
      "item": "100-node one-hour browser stability",
      "status": "pending",
      "path": "docs/M6_ACCEPTANCE.md",
      "target_work_package": "WP-2.1"
    },
    {
      "item": "real external-user usability validation and P0/P1 closure",
      "status": "pending",
      "path": "docs/M6_ACCEPTANCE.md",
      "target_work_package": "WP-2.3"
    }
  ],
  "known_exceptions": [],
  "started_at": "2026-09-28T00:15:47.666Z",
  "completed_at": "2026-09-28T00:15:57.996Z",
  "result": "pass"
}
